{
  "schema": "mactech.collector.evidence-index.v1",
  "version": "1.0.0",
  "run_id": "20260305T074916Z-a00d8782",
  "organization_id": "b6e1b0e2-c589-4c72-8cd2-43de8619fced",
  "boundary_id": "e2a587cf-fd7d-4ce6-b224-a56db31fa52d",
  "files": [
    {
      "path": "host/systeminfo.txt",
      "sha256": "0000000000000000000000000000000000000000000000000000000000000000",
      "bytes": 12345,
      "content_type": "text/plain",
      "exportable": false,
      "contains_sensitive": true,
      "produced_by": "Collect-Cui-Evidence-v2.ps1",
      "description": "System information output (may contain host identifiers)."
    },
    {
      "path": "network/firewall-rules-summary.txt",
      "sha256": "1111111111111111111111111111111111111111111111111111111111111111",
      "bytes": 4567,
      "content_type": "text/plain",
      "exportable": true,
      "contains_sensitive": false,
      "produced_by": "collect_windows2025_cmmc_evidence.ps1",
      "description": "Firewall rules summary used for AC/SC controls."
    }
  ]
}